{
  "$schema": "https://json-schema.org/draft/2020-12/schema",
  "title": "Whisper exercises",
  "description": "Resonance exercises done in a whisper, with no voice, read from the formants of the whispered sound. Shown in file order.",
  "type": "array",
  "items": {
    "type": "object",
    "additionalProperties": false,
    "required": ["id", "title", "cue", "sub", "kind", "vowel", "why", "steps"],
    "properties": {
      "id": {"type": "string", "pattern": "^wh-[a-z0-9]+(-[a-z0-9]+)*$", "description": "Stable id starting with wh-. Practice history refers to it, so never change or reuse one that has shipped."},
      "title": {"type": "string", "description": "Heading on the exercise."},
      "cue": {"type": "string", "description": "Short name on the exercise card."},
      "sub": {"type": "string", "description": "A few words under the name on the card."},
      "kind": {"enum": ["siren", "hold"], "description": "siren: slide the whisper's brightness up and down; done after two full slides. hold: hold the whispered vowel in the goal zone for about two seconds. Each kind has its own check in src/app.js, so a new kind is a code change."},
      "vowel": {"enum": ["i", "I", "e", "E", "ae", "a", "c", "V", "o", "U", "u", "r"], "description": "Vowel key from the formant table in src/dsp.js (see control.schema.json for the list). For hold, the vowel the score is measured against; for siren, the vowel the demo starts from."},
      "why": {"type": "string", "description": "One or two sentences on what the exercise is for."},
      "steps": {
        "type": "array", "minItems": 1,
        "items": {
          "oneOf": [
            {"type": "string"},
            {"type": "object", "additionalProperties": false, "required": ["feminine", "masculine"],
             "properties": {"feminine": {"type": "string"}, "masculine": {"type": "string"}},
             "description": "A step that depends on the training goal."}
          ]
        },
        "description": "Steps shown in order. Use an object with feminine and masculine for a step that differs by goal."
      }
    }
  }
}
